{
  "schema_version": "model-skyline/v1alpha1",
  "kind": "publication",
  "hash_algorithm": "sha256-rfc8785-v1",
  "publication_id": "eb94673f01d74ddec4933313ffa2354c54d93793c0d2082c2fe10c1221056917",
  "project_id": "aider-models-dev",
  "previous_publication_id": "d13ca80bafc8ea50ea9f62526a7efe79196bcfc3d3737d945b0b8f5c9dc7d058",
  "project_hash": "dcb6d4dace712ee00dd22c86186dcf1197b56347a81ece478e264e06df3391a7",
  "generated_at": "2026-10-07T14:31:10.853161Z",
  "catalogs": [
    {
      "workload": {
        "id": "aider-polyglot",
        "version": "sha256:bb92c4555c1341c52f386c8c8b1ba7c5b3c56cec60a5f9129ecf8ee99a8cc2a8",
        "unit": "polyglot_case"
      },
      "catalog_hash": "af6428f043e06b5b7aaec74efb9d06677dc88e3f739a06b23ccfd13ac35f17a7"
    }
  ],
  "policy": {
    "public": true,
    "allowed_licenses": [
      "Apache-2.0",
      "MIT"
    ],
    "authorized_source_ids": []
  },
  "frontiers": [
    {
      "frontier_id": "price-snapshot-cost-per-attempted-vs-solve-rate",
      "snapshot_id": "c90a8afb51e0d293aaa88c211eb376ec9c675c67c1a24b60ec4a13c63892af39",
      "snapshot": {
        "path": "frontiers/price-snapshot-cost-per-attempted-vs-solve-rate/c90a8afb51e0d293aaa88c211eb376ec9c675c67c1a24b60ec4a13c63892af39.json",
        "sha256": "735aeddf4bff186cbca054b044725c1dfd51f6652cac9e517c36ba4b3ab4f4e8",
        "media_type": "application/json"
      },
      "csv": {
        "path": "frontiers/price-snapshot-cost-per-attempted-vs-solve-rate/c90a8afb51e0d293aaa88c211eb376ec9c675c67c1a24b60ec4a13c63892af39.csv",
        "sha256": "9612e90d5654625cb7c626671c1cb121f3b62481c3f2602449fa95af80edcada",
        "media_type": "text/csv; charset=utf-8"
      },
      "table": {
        "path": "frontiers/price-snapshot-cost-per-attempted-vs-solve-rate/c90a8afb51e0d293aaa88c211eb376ec9c675c67c1a24b60ec4a13c63892af39.txt",
        "sha256": "336b3761f935a42cd319241ef0390430a1ec60aa55292c017a7a9a2920436256",
        "media_type": "text/plain; charset=utf-8"
      },
      "history": {
        "path": "frontiers/price-snapshot-cost-per-attempted-vs-solve-rate/history-421c1e8d96341b368e9d7779542467aeeb746c6c05b0b40bf1ee987959d64b1a.json",
        "sha256": "421c1e8d96341b368e9d7779542467aeeb746c6c05b0b40bf1ee987959d64b1a",
        "media_type": "application/json"
      },
      "feed": {
        "path": "feeds/price-snapshot-cost-per-attempted-vs-solve-rate/d1932e6fbdb0f913cbc1468e4d46ebe7c7f226accd1280e48734cf5736679b68.xml",
        "sha256": "d1932e6fbdb0f913cbc1468e4d46ebe7c7f226accd1280e48734cf5736679b68",
        "media_type": "application/rss+xml"
      }
    },
    {
      "frontier_id": "price-snapshot-cost-per-solved-vs-solve-rate",
      "snapshot_id": "d21e365c188f7dc412970619acec922fe487ac2d33c22a359d296fb361c7e5ef",
      "snapshot": {
        "path": "frontiers/price-snapshot-cost-per-solved-vs-solve-rate/d21e365c188f7dc412970619acec922fe487ac2d33c22a359d296fb361c7e5ef.json",
        "sha256": "b5fa0102b8b818ae6fdebd1436785f6cfe252ed10c5689ea19a2498072ef0e5c",
        "media_type": "application/json"
      },
      "csv": {
        "path": "frontiers/price-snapshot-cost-per-solved-vs-solve-rate/d21e365c188f7dc412970619acec922fe487ac2d33c22a359d296fb361c7e5ef.csv",
        "sha256": "3eddd85bf3daa9aa00ef9325c7d3f4d838a477a5b9cd4b3ce600c992565c3de0",
        "media_type": "text/csv; charset=utf-8"
      },
      "table": {
        "path": "frontiers/price-snapshot-cost-per-solved-vs-solve-rate/d21e365c188f7dc412970619acec922fe487ac2d33c22a359d296fb361c7e5ef.txt",
        "sha256": "9dc5942e42449c297ef88d6b77c149f7ae93bc4147d7042d7865b2c98cda1f8b",
        "media_type": "text/plain; charset=utf-8"
      },
      "history": {
        "path": "frontiers/price-snapshot-cost-per-solved-vs-solve-rate/history-5e8dc57fbb8ca9801163688404067dc99adb8df5cb31a2ff3e08a1f22bee2f53.json",
        "sha256": "5e8dc57fbb8ca9801163688404067dc99adb8df5cb31a2ff3e08a1f22bee2f53",
        "media_type": "application/json"
      },
      "feed": {
        "path": "feeds/price-snapshot-cost-per-solved-vs-solve-rate/eb3c3120f22d67695f4f323eba6d98e8f52e0f53bf3c45cbafc0e6a931d97686.xml",
        "sha256": "eb3c3120f22d67695f4f323eba6d98e8f52e0f53bf3c45cbafc0e6a931d97686",
        "media_type": "application/rss+xml"
      }
    },
    {
      "frontier_id": "price-snapshot-reconstructed-token-cost-vs-solve-rate",
      "snapshot_id": "5dc23fe8da5a4f83be84c56635ab7081a63630680ceb2eb44921b26ed6fd5bc6",
      "snapshot": {
        "path": "frontiers/price-snapshot-reconstructed-token-cost-vs-solve-rate/5dc23fe8da5a4f83be84c56635ab7081a63630680ceb2eb44921b26ed6fd5bc6.json",
        "sha256": "aebf7dbf0df933744c02774e41c2c7d3d76e8c52e9cc184fd6343fb845d44be4",
        "media_type": "application/json"
      },
      "csv": {
        "path": "frontiers/price-snapshot-reconstructed-token-cost-vs-solve-rate/5dc23fe8da5a4f83be84c56635ab7081a63630680ceb2eb44921b26ed6fd5bc6.csv",
        "sha256": "21128c9832c06e21dad4b685edf609b5aa8d7a0a98d86e36ad285ab3e11e19cb",
        "media_type": "text/csv; charset=utf-8"
      },
      "table": {
        "path": "frontiers/price-snapshot-reconstructed-token-cost-vs-solve-rate/5dc23fe8da5a4f83be84c56635ab7081a63630680ceb2eb44921b26ed6fd5bc6.txt",
        "sha256": "63092b69e267ebcebf12cecac5ae5805234b6bbf9b24356acaf7c0b82fe85af2",
        "media_type": "text/plain; charset=utf-8"
      },
      "history": {
        "path": "frontiers/price-snapshot-reconstructed-token-cost-vs-solve-rate/history-2ba90a5faf36cc192f47baf08d84ae316ee6b6c903a92b21599c4799a15ba84c.json",
        "sha256": "2ba90a5faf36cc192f47baf08d84ae316ee6b6c903a92b21599c4799a15ba84c",
        "media_type": "application/json"
      },
      "feed": {
        "path": "feeds/price-snapshot-reconstructed-token-cost-vs-solve-rate/68134c9d8afd924447ab3c2164c3a33b6a6c6e6b1b8e9da1e80f68ff83e3489a.xml",
        "sha256": "68134c9d8afd924447ab3c2164c3a33b6a6c6e6b1b8e9da1e80f68ff83e3489a",
        "media_type": "application/rss+xml"
      }
    }
  ],
  "selections": []
}
