{
  "schema_version": "model-skyline/v1alpha1",
  "kind": "publication",
  "hash_algorithm": "sha256-rfc8785-v1",
  "publication_id": "b93a2925ff85ed835ed9dcca36997c97c0b0094862ee3bfb8fcebaea1bc65477",
  "project_id": "aider-models-dev",
  "previous_publication_id": "d29c42b3b76b86c7fb9ff68659fdc135f835b3fc1896444dd8818b1ad9351f9b",
  "project_hash": "1d4b5bbed2288e641c432159f7fb2525c3791a50453f2c4906067eb9d0f6a1ce",
  "generated_at": "2026-10-16T12:26:13.447657Z",
  "catalogs": [
    {
      "workload": {
        "id": "aider-polyglot",
        "version": "sha256:bb92c4555c1341c52f386c8c8b1ba7c5b3c56cec60a5f9129ecf8ee99a8cc2a8",
        "unit": "polyglot_case"
      },
      "catalog_hash": "e5c307ccc3d5dbefb8a23450656ef95f5851e10e6494c32bccc2a7ae01bd739b"
    }
  ],
  "policy": {
    "public": true,
    "allowed_licenses": [
      "Apache-2.0",
      "MIT"
    ],
    "authorized_source_ids": []
  },
  "frontiers": [
    {
      "frontier_id": "price-snapshot-cost-per-attempted-vs-solve-rate",
      "snapshot_id": "f1ccc617fcca7583baaf030a01bef19b1d83d206f59bf559dd590405c78546fc",
      "snapshot": {
        "path": "frontiers/price-snapshot-cost-per-attempted-vs-solve-rate/f1ccc617fcca7583baaf030a01bef19b1d83d206f59bf559dd590405c78546fc.json",
        "sha256": "6cd4742bbb286fb1b0018838641a225ec2fad2052a81bdd2f5c62961798347c3",
        "media_type": "application/json"
      },
      "csv": {
        "path": "frontiers/price-snapshot-cost-per-attempted-vs-solve-rate/f1ccc617fcca7583baaf030a01bef19b1d83d206f59bf559dd590405c78546fc.csv",
        "sha256": "9612e90d5654625cb7c626671c1cb121f3b62481c3f2602449fa95af80edcada",
        "media_type": "text/csv; charset=utf-8"
      },
      "table": {
        "path": "frontiers/price-snapshot-cost-per-attempted-vs-solve-rate/f1ccc617fcca7583baaf030a01bef19b1d83d206f59bf559dd590405c78546fc.txt",
        "sha256": "336b3761f935a42cd319241ef0390430a1ec60aa55292c017a7a9a2920436256",
        "media_type": "text/plain; charset=utf-8"
      },
      "history": {
        "path": "frontiers/price-snapshot-cost-per-attempted-vs-solve-rate/history-9392c4fc0e92fcf2c7b2cffe36390c7f37b8e5cd2c2a5a9b82165dc76ac1d131.json",
        "sha256": "9392c4fc0e92fcf2c7b2cffe36390c7f37b8e5cd2c2a5a9b82165dc76ac1d131",
        "media_type": "application/json"
      },
      "feed": {
        "path": "feeds/price-snapshot-cost-per-attempted-vs-solve-rate/aaf240d82d92ef7a8faea2bb3ad739bf733a07fd5c23fc788a7cd1a439f2739f.xml",
        "sha256": "aaf240d82d92ef7a8faea2bb3ad739bf733a07fd5c23fc788a7cd1a439f2739f",
        "media_type": "application/rss+xml"
      }
    },
    {
      "frontier_id": "price-snapshot-cost-per-solved-vs-solve-rate",
      "snapshot_id": "e6e95277af1418ec9a09a8d38e58850bd3ab5c6029ca5f89629ff47c51c415e1",
      "snapshot": {
        "path": "frontiers/price-snapshot-cost-per-solved-vs-solve-rate/e6e95277af1418ec9a09a8d38e58850bd3ab5c6029ca5f89629ff47c51c415e1.json",
        "sha256": "3ed897aa65c463d01dc1586f8962fe5477d8d1a5ad60c51750a106796af62128",
        "media_type": "application/json"
      },
      "csv": {
        "path": "frontiers/price-snapshot-cost-per-solved-vs-solve-rate/e6e95277af1418ec9a09a8d38e58850bd3ab5c6029ca5f89629ff47c51c415e1.csv",
        "sha256": "3eddd85bf3daa9aa00ef9325c7d3f4d838a477a5b9cd4b3ce600c992565c3de0",
        "media_type": "text/csv; charset=utf-8"
      },
      "table": {
        "path": "frontiers/price-snapshot-cost-per-solved-vs-solve-rate/e6e95277af1418ec9a09a8d38e58850bd3ab5c6029ca5f89629ff47c51c415e1.txt",
        "sha256": "9dc5942e42449c297ef88d6b77c149f7ae93bc4147d7042d7865b2c98cda1f8b",
        "media_type": "text/plain; charset=utf-8"
      },
      "history": {
        "path": "frontiers/price-snapshot-cost-per-solved-vs-solve-rate/history-76d2698424e00722c4c1ac27768023d0533ad2b36090fcfe212dcf6e6db31cef.json",
        "sha256": "76d2698424e00722c4c1ac27768023d0533ad2b36090fcfe212dcf6e6db31cef",
        "media_type": "application/json"
      },
      "feed": {
        "path": "feeds/price-snapshot-cost-per-solved-vs-solve-rate/5a69a4fa39dee77d0b89c26e791402d451fffa7203db259dc3251c46b07713bb.xml",
        "sha256": "5a69a4fa39dee77d0b89c26e791402d451fffa7203db259dc3251c46b07713bb",
        "media_type": "application/rss+xml"
      }
    },
    {
      "frontier_id": "price-snapshot-reconstructed-token-cost-vs-solve-rate",
      "snapshot_id": "65c9808eb41efebc9bc90afa7b9ea25ab38431b3e598de527400af2ce56aa2ce",
      "snapshot": {
        "path": "frontiers/price-snapshot-reconstructed-token-cost-vs-solve-rate/65c9808eb41efebc9bc90afa7b9ea25ab38431b3e598de527400af2ce56aa2ce.json",
        "sha256": "72051d2025b4689888f4bd12bf99785e03652aa22c7903e28ec795bfbb752def",
        "media_type": "application/json"
      },
      "csv": {
        "path": "frontiers/price-snapshot-reconstructed-token-cost-vs-solve-rate/65c9808eb41efebc9bc90afa7b9ea25ab38431b3e598de527400af2ce56aa2ce.csv",
        "sha256": "21128c9832c06e21dad4b685edf609b5aa8d7a0a98d86e36ad285ab3e11e19cb",
        "media_type": "text/csv; charset=utf-8"
      },
      "table": {
        "path": "frontiers/price-snapshot-reconstructed-token-cost-vs-solve-rate/65c9808eb41efebc9bc90afa7b9ea25ab38431b3e598de527400af2ce56aa2ce.txt",
        "sha256": "63092b69e267ebcebf12cecac5ae5805234b6bbf9b24356acaf7c0b82fe85af2",
        "media_type": "text/plain; charset=utf-8"
      },
      "history": {
        "path": "frontiers/price-snapshot-reconstructed-token-cost-vs-solve-rate/history-fcc789144072821d78af3b1f6200baa63fbe5c4c409958f5526da2c152ca6685.json",
        "sha256": "fcc789144072821d78af3b1f6200baa63fbe5c4c409958f5526da2c152ca6685",
        "media_type": "application/json"
      },
      "feed": {
        "path": "feeds/price-snapshot-reconstructed-token-cost-vs-solve-rate/4ded0fe37fe3f44bdf04f64b55febd0c97bd41ea84e5f21c2cb0064959175197.xml",
        "sha256": "4ded0fe37fe3f44bdf04f64b55febd0c97bd41ea84e5f21c2cb0064959175197",
        "media_type": "application/rss+xml"
      }
    }
  ],
  "selections": []
}
