{
  "schema_version": "model-skyline/v1alpha1",
  "kind": "publication",
  "hash_algorithm": "sha256-rfc8785-v1",
  "publication_id": "21a1f43cc0d37aa6904d4357833c0eefffd24b5e547c46fa44a3763cdc61c1bc",
  "project_id": "aider-models-dev",
  "previous_publication_id": "63cf99ca54744e7fb78042b044a9ac8a62d9b5652e9256b8a6511839dbcf237d",
  "project_hash": "e02eaabb46cbbd2ccdddd3018f20dc46cf583029f0ef5786ea952a965a5ae4a5",
  "generated_at": "2026-10-31T13:39:38.633377Z",
  "catalogs": [
    {
      "workload": {
        "id": "aider-polyglot",
        "version": "sha256:bb92c4555c1341c52f386c8c8b1ba7c5b3c56cec60a5f9129ecf8ee99a8cc2a8",
        "unit": "polyglot_case"
      },
      "catalog_hash": "bbe8731ea948f708db0b502a97b7d14d70b611d4919b68dc0f0696ca2a676cd3"
    }
  ],
  "policy": {
    "public": true,
    "allowed_licenses": [
      "Apache-2.0",
      "MIT"
    ],
    "authorized_source_ids": []
  },
  "frontiers": [
    {
      "frontier_id": "price-snapshot-cost-per-attempted-vs-solve-rate",
      "snapshot_id": "67ea8b78e05eff224c31a5f35a9f3cc65eece86093f33ec5a19009dd433a3dd6",
      "snapshot": {
        "path": "frontiers/price-snapshot-cost-per-attempted-vs-solve-rate/67ea8b78e05eff224c31a5f35a9f3cc65eece86093f33ec5a19009dd433a3dd6.json",
        "sha256": "1e9d6b30fe70812c06f41042d784a18d9993f25cb124a676d0cb498bdef92b6c",
        "media_type": "application/json"
      },
      "csv": {
        "path": "frontiers/price-snapshot-cost-per-attempted-vs-solve-rate/67ea8b78e05eff224c31a5f35a9f3cc65eece86093f33ec5a19009dd433a3dd6.csv",
        "sha256": "9612e90d5654625cb7c626671c1cb121f3b62481c3f2602449fa95af80edcada",
        "media_type": "text/csv; charset=utf-8"
      },
      "table": {
        "path": "frontiers/price-snapshot-cost-per-attempted-vs-solve-rate/67ea8b78e05eff224c31a5f35a9f3cc65eece86093f33ec5a19009dd433a3dd6.txt",
        "sha256": "336b3761f935a42cd319241ef0390430a1ec60aa55292c017a7a9a2920436256",
        "media_type": "text/plain; charset=utf-8"
      },
      "history": {
        "path": "frontiers/price-snapshot-cost-per-attempted-vs-solve-rate/history-6cbc2906554a529c2f9335c41e1bd8b5b5d8841ddf490a4b3d9b3cbb5bd66987.json",
        "sha256": "6cbc2906554a529c2f9335c41e1bd8b5b5d8841ddf490a4b3d9b3cbb5bd66987",
        "media_type": "application/json"
      },
      "feed": {
        "path": "feeds/price-snapshot-cost-per-attempted-vs-solve-rate/87877234be61d76f675abf8f64e8d77af2426e26a66f909395e565a23faea3e3.xml",
        "sha256": "87877234be61d76f675abf8f64e8d77af2426e26a66f909395e565a23faea3e3",
        "media_type": "application/rss+xml"
      }
    },
    {
      "frontier_id": "price-snapshot-cost-per-solved-vs-solve-rate",
      "snapshot_id": "8614134286322a1a8b8cb2200803fd647409d3846a2a45f3a2930090ba42ebc6",
      "snapshot": {
        "path": "frontiers/price-snapshot-cost-per-solved-vs-solve-rate/8614134286322a1a8b8cb2200803fd647409d3846a2a45f3a2930090ba42ebc6.json",
        "sha256": "dfe9c213b76dc03d1a4bcde8ba05b0a4796582bdaf2830745e7062bfbb062bae",
        "media_type": "application/json"
      },
      "csv": {
        "path": "frontiers/price-snapshot-cost-per-solved-vs-solve-rate/8614134286322a1a8b8cb2200803fd647409d3846a2a45f3a2930090ba42ebc6.csv",
        "sha256": "3eddd85bf3daa9aa00ef9325c7d3f4d838a477a5b9cd4b3ce600c992565c3de0",
        "media_type": "text/csv; charset=utf-8"
      },
      "table": {
        "path": "frontiers/price-snapshot-cost-per-solved-vs-solve-rate/8614134286322a1a8b8cb2200803fd647409d3846a2a45f3a2930090ba42ebc6.txt",
        "sha256": "9dc5942e42449c297ef88d6b77c149f7ae93bc4147d7042d7865b2c98cda1f8b",
        "media_type": "text/plain; charset=utf-8"
      },
      "history": {
        "path": "frontiers/price-snapshot-cost-per-solved-vs-solve-rate/history-80d21034d64d07a4c99a0dc338ccd6bcf2c968d868da4c1d455e983e8a93844f.json",
        "sha256": "80d21034d64d07a4c99a0dc338ccd6bcf2c968d868da4c1d455e983e8a93844f",
        "media_type": "application/json"
      },
      "feed": {
        "path": "feeds/price-snapshot-cost-per-solved-vs-solve-rate/32f48c37c6e3c3eec72614324fedb86e8f6632c24796c0e1e527c2d1e4c3d909.xml",
        "sha256": "32f48c37c6e3c3eec72614324fedb86e8f6632c24796c0e1e527c2d1e4c3d909",
        "media_type": "application/rss+xml"
      }
    },
    {
      "frontier_id": "price-snapshot-reconstructed-token-cost-vs-solve-rate",
      "snapshot_id": "ab5df71c216442e1d0f7fb6e635b3befecbc6ec6ffeb1a27f46ea26d53e36973",
      "snapshot": {
        "path": "frontiers/price-snapshot-reconstructed-token-cost-vs-solve-rate/ab5df71c216442e1d0f7fb6e635b3befecbc6ec6ffeb1a27f46ea26d53e36973.json",
        "sha256": "63bc0e0d4d6b4f05858b97c2a5dc97b9b7c7d755bfb590050d57d7218e3a5aba",
        "media_type": "application/json"
      },
      "csv": {
        "path": "frontiers/price-snapshot-reconstructed-token-cost-vs-solve-rate/ab5df71c216442e1d0f7fb6e635b3befecbc6ec6ffeb1a27f46ea26d53e36973.csv",
        "sha256": "21128c9832c06e21dad4b685edf609b5aa8d7a0a98d86e36ad285ab3e11e19cb",
        "media_type": "text/csv; charset=utf-8"
      },
      "table": {
        "path": "frontiers/price-snapshot-reconstructed-token-cost-vs-solve-rate/ab5df71c216442e1d0f7fb6e635b3befecbc6ec6ffeb1a27f46ea26d53e36973.txt",
        "sha256": "63092b69e267ebcebf12cecac5ae5805234b6bbf9b24356acaf7c0b82fe85af2",
        "media_type": "text/plain; charset=utf-8"
      },
      "history": {
        "path": "frontiers/price-snapshot-reconstructed-token-cost-vs-solve-rate/history-9891f6b4400b3aadd0358c540a10da8425afeb0f8bac79601e0f618c29f9aefe.json",
        "sha256": "9891f6b4400b3aadd0358c540a10da8425afeb0f8bac79601e0f618c29f9aefe",
        "media_type": "application/json"
      },
      "feed": {
        "path": "feeds/price-snapshot-reconstructed-token-cost-vs-solve-rate/95a2c34720250d590e959d89bfde4f35248830f044095ed53277ec0c1f5af519.xml",
        "sha256": "95a2c34720250d590e959d89bfde4f35248830f044095ed53277ec0c1f5af519",
        "media_type": "application/rss+xml"
      }
    }
  ],
  "selections": []
}
