{
  "schema_version": "model-skyline/v1alpha1",
  "kind": "publication",
  "hash_algorithm": "sha256-rfc8785-v1",
  "publication_id": "f2dcee1a2facad1ce822d5cd24ae7cb40ea5f9edbedd74bb47fa0875a4f498ee",
  "project_id": "aider-models-dev",
  "previous_publication_id": "8f6ed7123f527367734aed4de0d984b4981b30d19ce8ebd98b9900f6c4f317fb",
  "project_hash": "27157a38afe9cff6d571401a973042ce0c8749b93b982d305a173734e5d316e1",
  "generated_at": "2026-09-26T12:14:54.179064Z",
  "catalogs": [
    {
      "workload": {
        "id": "aider-polyglot",
        "version": "sha256:bb92c4555c1341c52f386c8c8b1ba7c5b3c56cec60a5f9129ecf8ee99a8cc2a8",
        "unit": "polyglot_case"
      },
      "catalog_hash": "21f7341a359ec6410f3b0104bcda8f2b915913cb8151c2929bfdf856e04ee528"
    }
  ],
  "policy": {
    "public": true,
    "allowed_licenses": [
      "Apache-2.0",
      "MIT"
    ],
    "authorized_source_ids": []
  },
  "frontiers": [
    {
      "frontier_id": "price-snapshot-cost-per-attempted-vs-solve-rate",
      "snapshot_id": "6cabfcce1feebdb5090b7f8796926e2e71ab525c1f83f0a93988f413c63e4776",
      "snapshot": {
        "path": "frontiers/price-snapshot-cost-per-attempted-vs-solve-rate/6cabfcce1feebdb5090b7f8796926e2e71ab525c1f83f0a93988f413c63e4776.json",
        "sha256": "1dbb80108e3ac739b927b0b6d23f4b509ab9915568aed4db4586121a9609b175",
        "media_type": "application/json"
      },
      "csv": {
        "path": "frontiers/price-snapshot-cost-per-attempted-vs-solve-rate/6cabfcce1feebdb5090b7f8796926e2e71ab525c1f83f0a93988f413c63e4776.csv",
        "sha256": "9612e90d5654625cb7c626671c1cb121f3b62481c3f2602449fa95af80edcada",
        "media_type": "text/csv; charset=utf-8"
      },
      "table": {
        "path": "frontiers/price-snapshot-cost-per-attempted-vs-solve-rate/6cabfcce1feebdb5090b7f8796926e2e71ab525c1f83f0a93988f413c63e4776.txt",
        "sha256": "336b3761f935a42cd319241ef0390430a1ec60aa55292c017a7a9a2920436256",
        "media_type": "text/plain; charset=utf-8"
      },
      "history": {
        "path": "frontiers/price-snapshot-cost-per-attempted-vs-solve-rate/history-f7e9874ab6f95d0f910a66e1de3dc590e60e4389aa497150f6c7186b61886402.json",
        "sha256": "f7e9874ab6f95d0f910a66e1de3dc590e60e4389aa497150f6c7186b61886402",
        "media_type": "application/json"
      },
      "feed": {
        "path": "feeds/price-snapshot-cost-per-attempted-vs-solve-rate/531e2248ea608948408dc2ef0b469905aa4864b0bb5f90d4a4dccc3fe210ff3a.xml",
        "sha256": "531e2248ea608948408dc2ef0b469905aa4864b0bb5f90d4a4dccc3fe210ff3a",
        "media_type": "application/rss+xml"
      }
    },
    {
      "frontier_id": "price-snapshot-cost-per-solved-vs-solve-rate",
      "snapshot_id": "18b99cb81a7611988ecc04d23618fa2e4d2f97a94bab1d655c246b724b520a6f",
      "snapshot": {
        "path": "frontiers/price-snapshot-cost-per-solved-vs-solve-rate/18b99cb81a7611988ecc04d23618fa2e4d2f97a94bab1d655c246b724b520a6f.json",
        "sha256": "7682d117448dd24b09a89b286dc2023f042e264fda4ef0d24e9da56f2b24ea79",
        "media_type": "application/json"
      },
      "csv": {
        "path": "frontiers/price-snapshot-cost-per-solved-vs-solve-rate/18b99cb81a7611988ecc04d23618fa2e4d2f97a94bab1d655c246b724b520a6f.csv",
        "sha256": "3eddd85bf3daa9aa00ef9325c7d3f4d838a477a5b9cd4b3ce600c992565c3de0",
        "media_type": "text/csv; charset=utf-8"
      },
      "table": {
        "path": "frontiers/price-snapshot-cost-per-solved-vs-solve-rate/18b99cb81a7611988ecc04d23618fa2e4d2f97a94bab1d655c246b724b520a6f.txt",
        "sha256": "9dc5942e42449c297ef88d6b77c149f7ae93bc4147d7042d7865b2c98cda1f8b",
        "media_type": "text/plain; charset=utf-8"
      },
      "history": {
        "path": "frontiers/price-snapshot-cost-per-solved-vs-solve-rate/history-a9c63d024619f46e6b442c849fe27f6c3c419f35008025d3fe6d9fc37a806017.json",
        "sha256": "a9c63d024619f46e6b442c849fe27f6c3c419f35008025d3fe6d9fc37a806017",
        "media_type": "application/json"
      },
      "feed": {
        "path": "feeds/price-snapshot-cost-per-solved-vs-solve-rate/256f4898f1bd3c3e21e1086f670eb540eeb0b15405fe67db41c448e31fdf74b3.xml",
        "sha256": "256f4898f1bd3c3e21e1086f670eb540eeb0b15405fe67db41c448e31fdf74b3",
        "media_type": "application/rss+xml"
      }
    },
    {
      "frontier_id": "price-snapshot-reconstructed-token-cost-vs-solve-rate",
      "snapshot_id": "8da24c99ecb252564ed2e58c943b4092185e1b7626fdea0bc65316117ff52497",
      "snapshot": {
        "path": "frontiers/price-snapshot-reconstructed-token-cost-vs-solve-rate/8da24c99ecb252564ed2e58c943b4092185e1b7626fdea0bc65316117ff52497.json",
        "sha256": "08260f7c67a8663f2f459917a64f82202fedffcae6947af0ac6b23c46dbcf335",
        "media_type": "application/json"
      },
      "csv": {
        "path": "frontiers/price-snapshot-reconstructed-token-cost-vs-solve-rate/8da24c99ecb252564ed2e58c943b4092185e1b7626fdea0bc65316117ff52497.csv",
        "sha256": "21128c9832c06e21dad4b685edf609b5aa8d7a0a98d86e36ad285ab3e11e19cb",
        "media_type": "text/csv; charset=utf-8"
      },
      "table": {
        "path": "frontiers/price-snapshot-reconstructed-token-cost-vs-solve-rate/8da24c99ecb252564ed2e58c943b4092185e1b7626fdea0bc65316117ff52497.txt",
        "sha256": "63092b69e267ebcebf12cecac5ae5805234b6bbf9b24356acaf7c0b82fe85af2",
        "media_type": "text/plain; charset=utf-8"
      },
      "history": {
        "path": "frontiers/price-snapshot-reconstructed-token-cost-vs-solve-rate/history-192024c98bd485928ceaf828813b18a4f7f577c4d7991e1108f23a6d1ff573dc.json",
        "sha256": "192024c98bd485928ceaf828813b18a4f7f577c4d7991e1108f23a6d1ff573dc",
        "media_type": "application/json"
      },
      "feed": {
        "path": "feeds/price-snapshot-reconstructed-token-cost-vs-solve-rate/0fb3ef67c69d2c96a97b15e03366eb9df23b82ddaeb76f89f24b1594fda796cf.xml",
        "sha256": "0fb3ef67c69d2c96a97b15e03366eb9df23b82ddaeb76f89f24b1594fda796cf",
        "media_type": "application/rss+xml"
      }
    }
  ],
  "selections": []
}
