{
  "schema_version": "model-skyline/v1alpha1",
  "kind": "publication",
  "hash_algorithm": "sha256-rfc8785-v1",
  "publication_id": "513753694836e3447a0ce47f1a0082d09f29d986eec3bca5bf2b95afd1f44907",
  "project_id": "aider-models-dev",
  "previous_publication_id": "b15331f249b065ce11d83a9652536f26f0b7ec575eaaaeb6948d255b204505f7",
  "project_hash": "84b2e45f2555b512d76a00ea139245395c70a4e6b291bde6e6e63d0e12b7b884",
  "generated_at": "2026-09-21T14:10:13.357946Z",
  "catalogs": [
    {
      "workload": {
        "id": "aider-polyglot",
        "version": "sha256:bb92c4555c1341c52f386c8c8b1ba7c5b3c56cec60a5f9129ecf8ee99a8cc2a8",
        "unit": "polyglot_case"
      },
      "catalog_hash": "41c33e140e9ef73178dd42a6b6eac4848f92a1c60e3b83c7fd8f7fbf783eaa05"
    }
  ],
  "policy": {
    "public": true,
    "allowed_licenses": [
      "Apache-2.0",
      "MIT"
    ],
    "authorized_source_ids": []
  },
  "frontiers": [
    {
      "frontier_id": "price-snapshot-cost-per-attempted-vs-solve-rate",
      "snapshot_id": "b0e78cb90f06184f6159642b23cb41a731faa8d4435c164659fbe740fd9abc2b",
      "snapshot": {
        "path": "frontiers/price-snapshot-cost-per-attempted-vs-solve-rate/b0e78cb90f06184f6159642b23cb41a731faa8d4435c164659fbe740fd9abc2b.json",
        "sha256": "cc9bd5e687004540ef01fdd5b3fed272597394e9d1fc1ad955878b694f18a061",
        "media_type": "application/json"
      },
      "csv": {
        "path": "frontiers/price-snapshot-cost-per-attempted-vs-solve-rate/b0e78cb90f06184f6159642b23cb41a731faa8d4435c164659fbe740fd9abc2b.csv",
        "sha256": "9612e90d5654625cb7c626671c1cb121f3b62481c3f2602449fa95af80edcada",
        "media_type": "text/csv; charset=utf-8"
      },
      "table": {
        "path": "frontiers/price-snapshot-cost-per-attempted-vs-solve-rate/b0e78cb90f06184f6159642b23cb41a731faa8d4435c164659fbe740fd9abc2b.txt",
        "sha256": "336b3761f935a42cd319241ef0390430a1ec60aa55292c017a7a9a2920436256",
        "media_type": "text/plain; charset=utf-8"
      },
      "history": {
        "path": "frontiers/price-snapshot-cost-per-attempted-vs-solve-rate/history-586e114e4de2e95d0faf4b7882c3fbed9d8ddee2fd0c36f813af51d46539bbae.json",
        "sha256": "586e114e4de2e95d0faf4b7882c3fbed9d8ddee2fd0c36f813af51d46539bbae",
        "media_type": "application/json"
      },
      "feed": {
        "path": "feeds/price-snapshot-cost-per-attempted-vs-solve-rate/9af0283d8acf4729193667fa5ddeed5aba13d904287f5f662f5a0b882d7ee3ac.xml",
        "sha256": "9af0283d8acf4729193667fa5ddeed5aba13d904287f5f662f5a0b882d7ee3ac",
        "media_type": "application/rss+xml"
      }
    },
    {
      "frontier_id": "price-snapshot-cost-per-solved-vs-solve-rate",
      "snapshot_id": "021021c91bbc5be21ae0ed321991c7e21c3a634e3a28eff7c6bd5a7ee57e49f2",
      "snapshot": {
        "path": "frontiers/price-snapshot-cost-per-solved-vs-solve-rate/021021c91bbc5be21ae0ed321991c7e21c3a634e3a28eff7c6bd5a7ee57e49f2.json",
        "sha256": "15b7a13f68a31ced6c61ba349fa3fc1e3ebd1951da70b307ef7c51ede2b156f3",
        "media_type": "application/json"
      },
      "csv": {
        "path": "frontiers/price-snapshot-cost-per-solved-vs-solve-rate/021021c91bbc5be21ae0ed321991c7e21c3a634e3a28eff7c6bd5a7ee57e49f2.csv",
        "sha256": "3eddd85bf3daa9aa00ef9325c7d3f4d838a477a5b9cd4b3ce600c992565c3de0",
        "media_type": "text/csv; charset=utf-8"
      },
      "table": {
        "path": "frontiers/price-snapshot-cost-per-solved-vs-solve-rate/021021c91bbc5be21ae0ed321991c7e21c3a634e3a28eff7c6bd5a7ee57e49f2.txt",
        "sha256": "9dc5942e42449c297ef88d6b77c149f7ae93bc4147d7042d7865b2c98cda1f8b",
        "media_type": "text/plain; charset=utf-8"
      },
      "history": {
        "path": "frontiers/price-snapshot-cost-per-solved-vs-solve-rate/history-bdddbd8a156342d13de1a94a10e0a0195b83925beba319fb6468971153736dc4.json",
        "sha256": "bdddbd8a156342d13de1a94a10e0a0195b83925beba319fb6468971153736dc4",
        "media_type": "application/json"
      },
      "feed": {
        "path": "feeds/price-snapshot-cost-per-solved-vs-solve-rate/18e1b1ff6e885ca51c04900c3e3258815710a83b93a663eecad11d1d00424f0e.xml",
        "sha256": "18e1b1ff6e885ca51c04900c3e3258815710a83b93a663eecad11d1d00424f0e",
        "media_type": "application/rss+xml"
      }
    },
    {
      "frontier_id": "price-snapshot-reconstructed-token-cost-vs-solve-rate",
      "snapshot_id": "6b2d59d8f80262ba4a4f48ec7919fca37583c364374a3e59f78af32fb4df5a7e",
      "snapshot": {
        "path": "frontiers/price-snapshot-reconstructed-token-cost-vs-solve-rate/6b2d59d8f80262ba4a4f48ec7919fca37583c364374a3e59f78af32fb4df5a7e.json",
        "sha256": "03d02d705d92f816be79371fb26af79ff6a4a8944ea02e6e216fd45e8d7eff41",
        "media_type": "application/json"
      },
      "csv": {
        "path": "frontiers/price-snapshot-reconstructed-token-cost-vs-solve-rate/6b2d59d8f80262ba4a4f48ec7919fca37583c364374a3e59f78af32fb4df5a7e.csv",
        "sha256": "21128c9832c06e21dad4b685edf609b5aa8d7a0a98d86e36ad285ab3e11e19cb",
        "media_type": "text/csv; charset=utf-8"
      },
      "table": {
        "path": "frontiers/price-snapshot-reconstructed-token-cost-vs-solve-rate/6b2d59d8f80262ba4a4f48ec7919fca37583c364374a3e59f78af32fb4df5a7e.txt",
        "sha256": "63092b69e267ebcebf12cecac5ae5805234b6bbf9b24356acaf7c0b82fe85af2",
        "media_type": "text/plain; charset=utf-8"
      },
      "history": {
        "path": "frontiers/price-snapshot-reconstructed-token-cost-vs-solve-rate/history-d37fb58c0ca513d2098ab10c126be76e7f9420fad08e19c7c786149600924581.json",
        "sha256": "d37fb58c0ca513d2098ab10c126be76e7f9420fad08e19c7c786149600924581",
        "media_type": "application/json"
      },
      "feed": {
        "path": "feeds/price-snapshot-reconstructed-token-cost-vs-solve-rate/52644dd38ad3d69f407780394291679c1e3de27a2588ba18c2cf8fb5596afde8.xml",
        "sha256": "52644dd38ad3d69f407780394291679c1e3de27a2588ba18c2cf8fb5596afde8",
        "media_type": "application/rss+xml"
      }
    }
  ],
  "selections": []
}
