{
  "schema_version": "model-skyline/v1alpha1",
  "kind": "publication",
  "hash_algorithm": "sha256-rfc8785-v1",
  "publication_id": "980b9a5854773e063cc48c2e29b783f7c09532f1d4cf0625e5c0ece9d7b09e06",
  "project_id": "aider-polyglot",
  "previous_publication_id": "a9157efc96b8963b9d453807a24784ff9bec34f07a2e5167e9bf196a9e6efb1b",
  "project_hash": "4373acd39f5d3be3deb25abf4061c6c0fdc63aec2371605b39b16795e30ff07d",
  "generated_at": "2026-09-21T13:18:32.410251Z",
  "catalogs": [
    {
      "workload": {
        "id": "aider-polyglot",
        "version": "cb6a152e5ee27fbc77ac499d5e628ccd74a5fa2a",
        "unit": "polyglot_case"
      },
      "catalog_hash": "8ec71d8b1b1d84140dc95638d0356237ce2108a0a32629f61dcef7e936c14eea"
    }
  ],
  "policy": {
    "public": true,
    "allowed_licenses": [
      "Apache-2.0"
    ],
    "authorized_source_ids": []
  },
  "frontiers": [
    {
      "frontier_id": "agent-edit-seconds-vs-solve-rate",
      "snapshot_id": "b28905a3703f9f19edcf926e3798e3be2428249da2a007cb55773dbc0c6d73c8",
      "snapshot": {
        "path": "frontiers/agent-edit-seconds-vs-solve-rate/b28905a3703f9f19edcf926e3798e3be2428249da2a007cb55773dbc0c6d73c8.json",
        "sha256": "b4449cbacb08e3733726c69fb69fe24766a3b51ef5222517525aa452cb92f16a",
        "media_type": "application/json"
      },
      "csv": {
        "path": "frontiers/agent-edit-seconds-vs-solve-rate/b28905a3703f9f19edcf926e3798e3be2428249da2a007cb55773dbc0c6d73c8.csv",
        "sha256": "490593b44755219af6418f74db5d9b6d99518a5a5d0629bc5dcc83f39f418ab0",
        "media_type": "text/csv; charset=utf-8"
      },
      "table": {
        "path": "frontiers/agent-edit-seconds-vs-solve-rate/b28905a3703f9f19edcf926e3798e3be2428249da2a007cb55773dbc0c6d73c8.txt",
        "sha256": "e0db8d1483a2671403198e4b5e7658bae78212c5e5adbebd4536d5d3a604a671",
        "media_type": "text/plain; charset=utf-8"
      },
      "history": {
        "path": "frontiers/agent-edit-seconds-vs-solve-rate/history-6fdbfe64a2adfdbd53bcf6ef645fb1df78a6e8f4fe0e8d5dba943e2b2a5227bb.json",
        "sha256": "6fdbfe64a2adfdbd53bcf6ef645fb1df78a6e8f4fe0e8d5dba943e2b2a5227bb",
        "media_type": "application/json"
      },
      "feed": {
        "path": "feeds/agent-edit-seconds-vs-solve-rate/45eabfe5a9d6fc621d124796a63e208ab144b04ede198d328c759fa158ef6db8.xml",
        "sha256": "45eabfe5a9d6fc621d124796a63e208ab144b04ede198d328c759fa158ef6db8",
        "media_type": "application/rss+xml"
      }
    },
    {
      "frontier_id": "cost-per-attempted-vs-solve-rate",
      "snapshot_id": "6a3d871eb91ded731607f01932d044c210119a65eef7bbc88d3885ffd78c8f6d",
      "snapshot": {
        "path": "frontiers/cost-per-attempted-vs-solve-rate/6a3d871eb91ded731607f01932d044c210119a65eef7bbc88d3885ffd78c8f6d.json",
        "sha256": "4861a4ebbedc5c8188a7c65363fd44e1989401ff605e5440cac8b3fefda110a2",
        "media_type": "application/json"
      },
      "csv": {
        "path": "frontiers/cost-per-attempted-vs-solve-rate/6a3d871eb91ded731607f01932d044c210119a65eef7bbc88d3885ffd78c8f6d.csv",
        "sha256": "c36e26bed0a46816c4f0909ab0615b0d901005c12691edb703a2f4741654c2cb",
        "media_type": "text/csv; charset=utf-8"
      },
      "table": {
        "path": "frontiers/cost-per-attempted-vs-solve-rate/6a3d871eb91ded731607f01932d044c210119a65eef7bbc88d3885ffd78c8f6d.txt",
        "sha256": "1f6218587d78d519e00cd3d70e961354348bd88df30c5d5a0dd19c61c1a39d78",
        "media_type": "text/plain; charset=utf-8"
      },
      "history": {
        "path": "frontiers/cost-per-attempted-vs-solve-rate/history-10824bf71a2c8d953211c70e91d65b57f750116039e839b1c1a9fbcc07077539.json",
        "sha256": "10824bf71a2c8d953211c70e91d65b57f750116039e839b1c1a9fbcc07077539",
        "media_type": "application/json"
      },
      "feed": {
        "path": "feeds/cost-per-attempted-vs-solve-rate/44824374ef9db43143cabd7b8dc9920fe786774ece21577ca1320969fe9f2308.xml",
        "sha256": "44824374ef9db43143cabd7b8dc9920fe786774ece21577ca1320969fe9f2308",
        "media_type": "application/rss+xml"
      }
    },
    {
      "frontier_id": "cost-per-solved-vs-solve-rate",
      "snapshot_id": "9f3f03a49acc40f3ee51f5fb2969dfe8f186766b46fc5fd9d60923b3571df908",
      "snapshot": {
        "path": "frontiers/cost-per-solved-vs-solve-rate/9f3f03a49acc40f3ee51f5fb2969dfe8f186766b46fc5fd9d60923b3571df908.json",
        "sha256": "6a7d88c29a800297ea39e48213ebe5b433da6d55f7fe70dad9a7f14a5bbf991b",
        "media_type": "application/json"
      },
      "csv": {
        "path": "frontiers/cost-per-solved-vs-solve-rate/9f3f03a49acc40f3ee51f5fb2969dfe8f186766b46fc5fd9d60923b3571df908.csv",
        "sha256": "58ce9c3496d599fe87e2bc2ba37086d3895ba80f845a50b13883c135031bca56",
        "media_type": "text/csv; charset=utf-8"
      },
      "table": {
        "path": "frontiers/cost-per-solved-vs-solve-rate/9f3f03a49acc40f3ee51f5fb2969dfe8f186766b46fc5fd9d60923b3571df908.txt",
        "sha256": "1626f680c60ea9baec065728d3ea2dedc34460f4fb3e292553995b08122109af",
        "media_type": "text/plain; charset=utf-8"
      },
      "history": {
        "path": "frontiers/cost-per-solved-vs-solve-rate/history-4f40dc0e4fac88bc6c664f69a0419e63636c4df1437e35ddfd0087801135b6df.json",
        "sha256": "4f40dc0e4fac88bc6c664f69a0419e63636c4df1437e35ddfd0087801135b6df",
        "media_type": "application/json"
      },
      "feed": {
        "path": "feeds/cost-per-solved-vs-solve-rate/ddd0c0dd74ffbbb232ea9e6f82d0ff2f2459db3346dad359d44914e53643304a.xml",
        "sha256": "ddd0c0dd74ffbbb232ea9e6f82d0ff2f2459db3346dad359d44914e53643304a",
        "media_type": "application/rss+xml"
      }
    },
    {
      "frontier_id": "total-cost-vs-solve-rate",
      "snapshot_id": "9aa9dc11d48727ad97adcafb3e0e94cf58644402d8661f1fcc68b44a69e7405a",
      "snapshot": {
        "path": "frontiers/total-cost-vs-solve-rate/9aa9dc11d48727ad97adcafb3e0e94cf58644402d8661f1fcc68b44a69e7405a.json",
        "sha256": "9be08552f467c8b412ce1cf702122d35cfe8e78a42e028c4ac804db15bc1ae6f",
        "media_type": "application/json"
      },
      "csv": {
        "path": "frontiers/total-cost-vs-solve-rate/9aa9dc11d48727ad97adcafb3e0e94cf58644402d8661f1fcc68b44a69e7405a.csv",
        "sha256": "dba75d2e6a09fbb6997afa4d739c677214229838d4aa9db632994f80cabee4bf",
        "media_type": "text/csv; charset=utf-8"
      },
      "table": {
        "path": "frontiers/total-cost-vs-solve-rate/9aa9dc11d48727ad97adcafb3e0e94cf58644402d8661f1fcc68b44a69e7405a.txt",
        "sha256": "3916095b1d1d0ef95b9ad92bca7c8c1ba5e1e925561859a79e640ba832f5abb4",
        "media_type": "text/plain; charset=utf-8"
      },
      "history": {
        "path": "frontiers/total-cost-vs-solve-rate/history-dca8795c9195d084821e02661b14d95852fe2ec39e857f3609540b47469cb12c.json",
        "sha256": "dca8795c9195d084821e02661b14d95852fe2ec39e857f3609540b47469cb12c",
        "media_type": "application/json"
      },
      "feed": {
        "path": "feeds/total-cost-vs-solve-rate/7c0c76bb854a93bb9e94523e66fe01ae00b38af9cb5891fc9959b3dffbb9caf1.xml",
        "sha256": "7c0c76bb854a93bb9e94523e66fe01ae00b38af9cb5891fc9959b3dffbb9caf1",
        "media_type": "application/rss+xml"
      }
    }
  ],
  "selections": []
}
