{
  "schema_version": "model-skyline/v1alpha1",
  "kind": "publication",
  "hash_algorithm": "sha256-rfc8785-v1",
  "publication_id": "74b486952010e8e59aa4a96879b73428946b7b64e186ae940d3a6bb1e5501014",
  "project_id": "aider-models-dev",
  "previous_publication_id": "f2dcee1a2facad1ce822d5cd24ae7cb40ea5f9edbedd74bb47fa0875a4f498ee",
  "project_hash": "adf4616a80f25a6fd72e117bd1f9cada7f55e646698d1ccb96950e4eb0b60950",
  "generated_at": "2026-09-27T13:02:36.464941Z",
  "catalogs": [
    {
      "workload": {
        "id": "aider-polyglot",
        "version": "sha256:bb92c4555c1341c52f386c8c8b1ba7c5b3c56cec60a5f9129ecf8ee99a8cc2a8",
        "unit": "polyglot_case"
      },
      "catalog_hash": "cdca83b6a12368415c650cb30535ed2cad125261e8ac94a8e2c11261c4affea0"
    }
  ],
  "policy": {
    "public": true,
    "allowed_licenses": [
      "Apache-2.0",
      "MIT"
    ],
    "authorized_source_ids": []
  },
  "frontiers": [
    {
      "frontier_id": "price-snapshot-cost-per-attempted-vs-solve-rate",
      "snapshot_id": "12b9ce69dcaff2d408fa02f4d398484f37c4fbbc7e797c07dc307359ce83cda5",
      "snapshot": {
        "path": "frontiers/price-snapshot-cost-per-attempted-vs-solve-rate/12b9ce69dcaff2d408fa02f4d398484f37c4fbbc7e797c07dc307359ce83cda5.json",
        "sha256": "1efc31c1a33dbd7aa64e7d2067cbadb0819e7e471e010da4fe72f1b167479c41",
        "media_type": "application/json"
      },
      "csv": {
        "path": "frontiers/price-snapshot-cost-per-attempted-vs-solve-rate/12b9ce69dcaff2d408fa02f4d398484f37c4fbbc7e797c07dc307359ce83cda5.csv",
        "sha256": "9612e90d5654625cb7c626671c1cb121f3b62481c3f2602449fa95af80edcada",
        "media_type": "text/csv; charset=utf-8"
      },
      "table": {
        "path": "frontiers/price-snapshot-cost-per-attempted-vs-solve-rate/12b9ce69dcaff2d408fa02f4d398484f37c4fbbc7e797c07dc307359ce83cda5.txt",
        "sha256": "336b3761f935a42cd319241ef0390430a1ec60aa55292c017a7a9a2920436256",
        "media_type": "text/plain; charset=utf-8"
      },
      "history": {
        "path": "frontiers/price-snapshot-cost-per-attempted-vs-solve-rate/history-2c028eeae8d75fa71e3cfd24b4332e042b288e380988ab84576321708df1582b.json",
        "sha256": "2c028eeae8d75fa71e3cfd24b4332e042b288e380988ab84576321708df1582b",
        "media_type": "application/json"
      },
      "feed": {
        "path": "feeds/price-snapshot-cost-per-attempted-vs-solve-rate/07d80082069c6844e30dc7fcfa4e3e4e7742e0eacce856d19832c63eb08032c0.xml",
        "sha256": "07d80082069c6844e30dc7fcfa4e3e4e7742e0eacce856d19832c63eb08032c0",
        "media_type": "application/rss+xml"
      }
    },
    {
      "frontier_id": "price-snapshot-cost-per-solved-vs-solve-rate",
      "snapshot_id": "cb466789004a55360fcdd05206c2a944e133035eb95e12ae7db87d3a51622ff2",
      "snapshot": {
        "path": "frontiers/price-snapshot-cost-per-solved-vs-solve-rate/cb466789004a55360fcdd05206c2a944e133035eb95e12ae7db87d3a51622ff2.json",
        "sha256": "b0c855dc0b5dac5913fd0b444a3934fbcbcb8226a52843986a12df82210bad7c",
        "media_type": "application/json"
      },
      "csv": {
        "path": "frontiers/price-snapshot-cost-per-solved-vs-solve-rate/cb466789004a55360fcdd05206c2a944e133035eb95e12ae7db87d3a51622ff2.csv",
        "sha256": "3eddd85bf3daa9aa00ef9325c7d3f4d838a477a5b9cd4b3ce600c992565c3de0",
        "media_type": "text/csv; charset=utf-8"
      },
      "table": {
        "path": "frontiers/price-snapshot-cost-per-solved-vs-solve-rate/cb466789004a55360fcdd05206c2a944e133035eb95e12ae7db87d3a51622ff2.txt",
        "sha256": "9dc5942e42449c297ef88d6b77c149f7ae93bc4147d7042d7865b2c98cda1f8b",
        "media_type": "text/plain; charset=utf-8"
      },
      "history": {
        "path": "frontiers/price-snapshot-cost-per-solved-vs-solve-rate/history-9f7937ed5564cbac9886d914c7ed3b7ecb9a54c168a01a228d0862e2f71c781f.json",
        "sha256": "9f7937ed5564cbac9886d914c7ed3b7ecb9a54c168a01a228d0862e2f71c781f",
        "media_type": "application/json"
      },
      "feed": {
        "path": "feeds/price-snapshot-cost-per-solved-vs-solve-rate/85f0325025faf8b26c43e7cfa6a38f05e90d62225d67aea713c409193fd92e7a.xml",
        "sha256": "85f0325025faf8b26c43e7cfa6a38f05e90d62225d67aea713c409193fd92e7a",
        "media_type": "application/rss+xml"
      }
    },
    {
      "frontier_id": "price-snapshot-reconstructed-token-cost-vs-solve-rate",
      "snapshot_id": "b655741139de5f765234413b67c7275c0588508e9da00254c432f65b259261e3",
      "snapshot": {
        "path": "frontiers/price-snapshot-reconstructed-token-cost-vs-solve-rate/b655741139de5f765234413b67c7275c0588508e9da00254c432f65b259261e3.json",
        "sha256": "4011ac44108211ba1fdaeb94667b93c463aafdcdf23b4964494afe595419a7e4",
        "media_type": "application/json"
      },
      "csv": {
        "path": "frontiers/price-snapshot-reconstructed-token-cost-vs-solve-rate/b655741139de5f765234413b67c7275c0588508e9da00254c432f65b259261e3.csv",
        "sha256": "21128c9832c06e21dad4b685edf609b5aa8d7a0a98d86e36ad285ab3e11e19cb",
        "media_type": "text/csv; charset=utf-8"
      },
      "table": {
        "path": "frontiers/price-snapshot-reconstructed-token-cost-vs-solve-rate/b655741139de5f765234413b67c7275c0588508e9da00254c432f65b259261e3.txt",
        "sha256": "63092b69e267ebcebf12cecac5ae5805234b6bbf9b24356acaf7c0b82fe85af2",
        "media_type": "text/plain; charset=utf-8"
      },
      "history": {
        "path": "frontiers/price-snapshot-reconstructed-token-cost-vs-solve-rate/history-82a429748b644edb944ef4a70724b6a4e23556d64804251a16c8461f1eaafb6f.json",
        "sha256": "82a429748b644edb944ef4a70724b6a4e23556d64804251a16c8461f1eaafb6f",
        "media_type": "application/json"
      },
      "feed": {
        "path": "feeds/price-snapshot-reconstructed-token-cost-vs-solve-rate/0e35eb0859d2ed80475ea141eebebea17a05e1c38a9a1fc96c6c02a5631ff93b.xml",
        "sha256": "0e35eb0859d2ed80475ea141eebebea17a05e1c38a9a1fc96c6c02a5631ff93b",
        "media_type": "application/rss+xml"
      }
    }
  ],
  "selections": []
}
