{
  "schema_version": "model-skyline/v1alpha1",
  "kind": "publication",
  "hash_algorithm": "sha256-rfc8785-v1",
  "publication_id": "5765d545cf06b068ee328379bb088c5309b83a51d1743a00a442ff8362acfac3",
  "project_id": "aider-models-dev",
  "previous_publication_id": "c94ddf03e045139cab16a915790acaff978a4b48f1c4f35b8968ca3d407f9a47",
  "project_hash": "541cfde8ee89810d8e3c015f3713fb18a03011e5ff22d1b2040a8715cde81a65",
  "generated_at": "2026-09-05T11:16:43.631127Z",
  "catalogs": [
    {
      "workload": {
        "id": "aider-polyglot",
        "version": "sha256:bb92c4555c1341c52f386c8c8b1ba7c5b3c56cec60a5f9129ecf8ee99a8cc2a8",
        "unit": "polyglot_case"
      },
      "catalog_hash": "064a86fd9fa20af600470377b79a67a614afb272c7dcd642a1006fd700411714"
    }
  ],
  "policy": {
    "public": true,
    "allowed_licenses": [
      "Apache-2.0",
      "MIT"
    ],
    "authorized_source_ids": []
  },
  "frontiers": [
    {
      "frontier_id": "price-snapshot-cost-per-attempted-vs-solve-rate",
      "snapshot_id": "3a863eb7d75bad3b434caee8763e1f9dfe0d9b68180411243df2baf2791d5232",
      "snapshot": {
        "path": "frontiers/price-snapshot-cost-per-attempted-vs-solve-rate/3a863eb7d75bad3b434caee8763e1f9dfe0d9b68180411243df2baf2791d5232.json",
        "sha256": "7f04f8dc902ed13fac6fdc84c9b2e77f41839093674e495a493e9fa3b86a0060",
        "media_type": "application/json"
      },
      "csv": {
        "path": "frontiers/price-snapshot-cost-per-attempted-vs-solve-rate/3a863eb7d75bad3b434caee8763e1f9dfe0d9b68180411243df2baf2791d5232.csv",
        "sha256": "9612e90d5654625cb7c626671c1cb121f3b62481c3f2602449fa95af80edcada",
        "media_type": "text/csv; charset=utf-8"
      },
      "table": {
        "path": "frontiers/price-snapshot-cost-per-attempted-vs-solve-rate/3a863eb7d75bad3b434caee8763e1f9dfe0d9b68180411243df2baf2791d5232.txt",
        "sha256": "336b3761f935a42cd319241ef0390430a1ec60aa55292c017a7a9a2920436256",
        "media_type": "text/plain; charset=utf-8"
      },
      "history": {
        "path": "frontiers/price-snapshot-cost-per-attempted-vs-solve-rate/history-724ecd6e353503318f73d1f11a01c128baaad9df156bc3e3da085c8a5700f52e.json",
        "sha256": "724ecd6e353503318f73d1f11a01c128baaad9df156bc3e3da085c8a5700f52e",
        "media_type": "application/json"
      },
      "feed": {
        "path": "feeds/price-snapshot-cost-per-attempted-vs-solve-rate/d0f3c612d23a8b695a519aa6163469b7f1dc5c5706337bc372bab325fbce7a0f.xml",
        "sha256": "d0f3c612d23a8b695a519aa6163469b7f1dc5c5706337bc372bab325fbce7a0f",
        "media_type": "application/rss+xml"
      }
    },
    {
      "frontier_id": "price-snapshot-cost-per-solved-vs-solve-rate",
      "snapshot_id": "119aca94d6e68c3bf1133a0f66e72d549c758fabbe20e3918a235276791d6bc2",
      "snapshot": {
        "path": "frontiers/price-snapshot-cost-per-solved-vs-solve-rate/119aca94d6e68c3bf1133a0f66e72d549c758fabbe20e3918a235276791d6bc2.json",
        "sha256": "86c6177dd9d57f9715aed0532439a8a62dfc23cc42cc9cde69f5e847e09a84b0",
        "media_type": "application/json"
      },
      "csv": {
        "path": "frontiers/price-snapshot-cost-per-solved-vs-solve-rate/119aca94d6e68c3bf1133a0f66e72d549c758fabbe20e3918a235276791d6bc2.csv",
        "sha256": "3eddd85bf3daa9aa00ef9325c7d3f4d838a477a5b9cd4b3ce600c992565c3de0",
        "media_type": "text/csv; charset=utf-8"
      },
      "table": {
        "path": "frontiers/price-snapshot-cost-per-solved-vs-solve-rate/119aca94d6e68c3bf1133a0f66e72d549c758fabbe20e3918a235276791d6bc2.txt",
        "sha256": "9dc5942e42449c297ef88d6b77c149f7ae93bc4147d7042d7865b2c98cda1f8b",
        "media_type": "text/plain; charset=utf-8"
      },
      "history": {
        "path": "frontiers/price-snapshot-cost-per-solved-vs-solve-rate/history-ad93133bbc82a6e9d7923dc6f5430d259a1ecc44b064b3ce6bce5aa125e57f6a.json",
        "sha256": "ad93133bbc82a6e9d7923dc6f5430d259a1ecc44b064b3ce6bce5aa125e57f6a",
        "media_type": "application/json"
      },
      "feed": {
        "path": "feeds/price-snapshot-cost-per-solved-vs-solve-rate/9282571c4ed1f02363a8ba4f9f8e8f3b339a8e6f89c84af2b3ce0fac5e03d2d6.xml",
        "sha256": "9282571c4ed1f02363a8ba4f9f8e8f3b339a8e6f89c84af2b3ce0fac5e03d2d6",
        "media_type": "application/rss+xml"
      }
    },
    {
      "frontier_id": "price-snapshot-reconstructed-token-cost-vs-solve-rate",
      "snapshot_id": "73b5c1a57993a4032d4fcaacf74205803f43e86951c7457e4b118ea0f8ed3396",
      "snapshot": {
        "path": "frontiers/price-snapshot-reconstructed-token-cost-vs-solve-rate/73b5c1a57993a4032d4fcaacf74205803f43e86951c7457e4b118ea0f8ed3396.json",
        "sha256": "1aefa16df544cdedde6034c0e83d5b89531cee181c30475741775b26e891e49c",
        "media_type": "application/json"
      },
      "csv": {
        "path": "frontiers/price-snapshot-reconstructed-token-cost-vs-solve-rate/73b5c1a57993a4032d4fcaacf74205803f43e86951c7457e4b118ea0f8ed3396.csv",
        "sha256": "21128c9832c06e21dad4b685edf609b5aa8d7a0a98d86e36ad285ab3e11e19cb",
        "media_type": "text/csv; charset=utf-8"
      },
      "table": {
        "path": "frontiers/price-snapshot-reconstructed-token-cost-vs-solve-rate/73b5c1a57993a4032d4fcaacf74205803f43e86951c7457e4b118ea0f8ed3396.txt",
        "sha256": "63092b69e267ebcebf12cecac5ae5805234b6bbf9b24356acaf7c0b82fe85af2",
        "media_type": "text/plain; charset=utf-8"
      },
      "history": {
        "path": "frontiers/price-snapshot-reconstructed-token-cost-vs-solve-rate/history-efeb535bac6f444ab5b1066c29c1ad72f1f5d423e2862df05f6b54f5a3e7f854.json",
        "sha256": "efeb535bac6f444ab5b1066c29c1ad72f1f5d423e2862df05f6b54f5a3e7f854",
        "media_type": "application/json"
      },
      "feed": {
        "path": "feeds/price-snapshot-reconstructed-token-cost-vs-solve-rate/85939e54a43fc7fdc28f722a960eb18aaec5510e591de981bacd7a0915e6c239.xml",
        "sha256": "85939e54a43fc7fdc28f722a960eb18aaec5510e591de981bacd7a0915e6c239",
        "media_type": "application/rss+xml"
      }
    }
  ],
  "selections": []
}
