{
  "schema_version": "model-skyline/v1alpha1",
  "kind": "publication",
  "hash_algorithm": "sha256-rfc8785-v1",
  "publication_id": "54edb080d9b59358692ec4bb0f8de0616980d39561f9bc8e08f1414f28a3da9b",
  "project_id": "aider-gpt5-models-dev",
  "previous_publication_id": "19fbcfd32bd0cde0b1179308555465917117c95619e0f4083a4c3ad673706f81",
  "project_hash": "8dc304759cc28be6ab79f485b368255b1a8ea8e67aa9a35f12ba486280b50bd1",
  "generated_at": "2026-09-01T09:19:10.490121Z",
  "catalogs": [
    {
      "workload": {
        "id": "aider-polyglot",
        "version": "sha256:baa026c95992c1cec4650d1396b4046d10bc957966846f0bdfcee142e9748858",
        "unit": "polyglot_case"
      },
      "catalog_hash": "86826023b62c3911bdc6f40d6f82c54394d3905d21def94936a95df9fd58c826"
    }
  ],
  "policy": {
    "public": true,
    "allowed_licenses": [
      "Apache-2.0",
      "MIT"
    ],
    "authorized_source_ids": []
  },
  "frontiers": [
    {
      "frontier_id": "price-snapshot-cost-per-attempted-vs-solve-rate",
      "snapshot_id": "ea3c241d73f0123a010e46e66faa0c8b6a612ab62fd5339013fdcaa84f81f183",
      "snapshot": {
        "path": "frontiers/price-snapshot-cost-per-attempted-vs-solve-rate/ea3c241d73f0123a010e46e66faa0c8b6a612ab62fd5339013fdcaa84f81f183.json",
        "sha256": "e5b4f2ced0f7256c6c037e7795172d6b35195b84a808aef9bd98f5f9f3978d99",
        "media_type": "application/json"
      },
      "csv": {
        "path": "frontiers/price-snapshot-cost-per-attempted-vs-solve-rate/ea3c241d73f0123a010e46e66faa0c8b6a612ab62fd5339013fdcaa84f81f183.csv",
        "sha256": "9612e90d5654625cb7c626671c1cb121f3b62481c3f2602449fa95af80edcada",
        "media_type": "text/csv; charset=utf-8"
      },
      "table": {
        "path": "frontiers/price-snapshot-cost-per-attempted-vs-solve-rate/ea3c241d73f0123a010e46e66faa0c8b6a612ab62fd5339013fdcaa84f81f183.txt",
        "sha256": "336b3761f935a42cd319241ef0390430a1ec60aa55292c017a7a9a2920436256",
        "media_type": "text/plain; charset=utf-8"
      },
      "history": {
        "path": "frontiers/price-snapshot-cost-per-attempted-vs-solve-rate/history-bcd19f3deb9d6807ff5aa687c3e2e3c08063b337d0e5a557bc605661e697e1e0.json",
        "sha256": "bcd19f3deb9d6807ff5aa687c3e2e3c08063b337d0e5a557bc605661e697e1e0",
        "media_type": "application/json"
      },
      "feed": {
        "path": "feeds/price-snapshot-cost-per-attempted-vs-solve-rate/96d44dad6bac3b4ca9a7f9bb3431b2c9fc392372599847e448485d946abe795f.xml",
        "sha256": "96d44dad6bac3b4ca9a7f9bb3431b2c9fc392372599847e448485d946abe795f",
        "media_type": "application/rss+xml"
      }
    },
    {
      "frontier_id": "price-snapshot-cost-per-solved-vs-solve-rate",
      "snapshot_id": "c4d409de61d1e3cec149bf66a0a4f6b5578e3388a00419b641966b10d3148549",
      "snapshot": {
        "path": "frontiers/price-snapshot-cost-per-solved-vs-solve-rate/c4d409de61d1e3cec149bf66a0a4f6b5578e3388a00419b641966b10d3148549.json",
        "sha256": "b5f0563c6e0eedf389d2fc3e5b4ec7ded951b9e2ccad8942973e3ac84d9621fd",
        "media_type": "application/json"
      },
      "csv": {
        "path": "frontiers/price-snapshot-cost-per-solved-vs-solve-rate/c4d409de61d1e3cec149bf66a0a4f6b5578e3388a00419b641966b10d3148549.csv",
        "sha256": "3eddd85bf3daa9aa00ef9325c7d3f4d838a477a5b9cd4b3ce600c992565c3de0",
        "media_type": "text/csv; charset=utf-8"
      },
      "table": {
        "path": "frontiers/price-snapshot-cost-per-solved-vs-solve-rate/c4d409de61d1e3cec149bf66a0a4f6b5578e3388a00419b641966b10d3148549.txt",
        "sha256": "9dc5942e42449c297ef88d6b77c149f7ae93bc4147d7042d7865b2c98cda1f8b",
        "media_type": "text/plain; charset=utf-8"
      },
      "history": {
        "path": "frontiers/price-snapshot-cost-per-solved-vs-solve-rate/history-d4658eeb93a9e1410b7c19af837e2e11e9bbaaef9b4a0bae24080e47967250be.json",
        "sha256": "d4658eeb93a9e1410b7c19af837e2e11e9bbaaef9b4a0bae24080e47967250be",
        "media_type": "application/json"
      },
      "feed": {
        "path": "feeds/price-snapshot-cost-per-solved-vs-solve-rate/e14a1307928bcbbdd45fb700c387d5d3fe88a0807e37df9d97d2e0500323b1ff.xml",
        "sha256": "e14a1307928bcbbdd45fb700c387d5d3fe88a0807e37df9d97d2e0500323b1ff",
        "media_type": "application/rss+xml"
      }
    },
    {
      "frontier_id": "price-snapshot-reconstructed-token-cost-vs-solve-rate",
      "snapshot_id": "65962428dde2566529cd47d0aa632b6517c74d72e17b9fa7d3d43a8b7c826775",
      "snapshot": {
        "path": "frontiers/price-snapshot-reconstructed-token-cost-vs-solve-rate/65962428dde2566529cd47d0aa632b6517c74d72e17b9fa7d3d43a8b7c826775.json",
        "sha256": "9958612101e9f7a90774de087064975f4ec509e06dab3fec0fd17737a240162f",
        "media_type": "application/json"
      },
      "csv": {
        "path": "frontiers/price-snapshot-reconstructed-token-cost-vs-solve-rate/65962428dde2566529cd47d0aa632b6517c74d72e17b9fa7d3d43a8b7c826775.csv",
        "sha256": "21128c9832c06e21dad4b685edf609b5aa8d7a0a98d86e36ad285ab3e11e19cb",
        "media_type": "text/csv; charset=utf-8"
      },
      "table": {
        "path": "frontiers/price-snapshot-reconstructed-token-cost-vs-solve-rate/65962428dde2566529cd47d0aa632b6517c74d72e17b9fa7d3d43a8b7c826775.txt",
        "sha256": "63092b69e267ebcebf12cecac5ae5805234b6bbf9b24356acaf7c0b82fe85af2",
        "media_type": "text/plain; charset=utf-8"
      },
      "history": {
        "path": "frontiers/price-snapshot-reconstructed-token-cost-vs-solve-rate/history-81f6c99297cf18e7bef413774cc6a1fa02ec6032cba32dd44f049d51af803436.json",
        "sha256": "81f6c99297cf18e7bef413774cc6a1fa02ec6032cba32dd44f049d51af803436",
        "media_type": "application/json"
      },
      "feed": {
        "path": "feeds/price-snapshot-reconstructed-token-cost-vs-solve-rate/731884b3ab09988dba037f5506f4cb73104698c5723cf822e23f7f0b427f45d4.xml",
        "sha256": "731884b3ab09988dba037f5506f4cb73104698c5723cf822e23f7f0b427f45d4",
        "media_type": "application/rss+xml"
      }
    }
  ],
  "selections": []
}
